<?xml version="1.0" encoding="UTF-8" standalone="no"?>
<!DOCTYPE data_report SYSTEM "xml/data_report.dtd">
<data_report>
  <user_data>
    <name>Μενέλαος Συνοδινός</name>
    <vat>123456656</vat>
    <address>Γούναρη 120</address>
    <prefecture>Αχαΐας</prefecture>
    <municipality>Πατρέων</municipality>
  </user_data>
  <offers>
    <offer>
      <fuel_type>Αμόλυβδη Βενζίνη 95</fuel_type>
      <expiring_date>2023-07-08</expiring_date>
      <price>2.00€</price>
      <active>True</active>
    </offer>
    <offer>
      <fuel_type>Αμόλυβδη Βενζίνη 98</fuel_type>
      <expiring_date>2023-06-10</expiring_date>
      <price>2.50€</price>
      <active>True</active>
    </offer>
    <offer>
      <fuel_type>Αμόλυβδη Βενζίνη 100</fuel_type>
      <expiring_date>2023-06-09</expiring_date>
      <price>3.00€</price>
      <active>True</active>
    </offer>
    <offer>
      <fuel_type>Πετρέλαιο Θέρμανσης</fuel_type>
      <expiring_date>2023-04-08</expiring_date>
      <price>2.00€</price>
      <active>False</active>
    </offer>
  </offers>
</data_report>
